{
  "type": "MULTIPLE_CHOICE",
  "id": "lesson-8-4-maven-commands",
  "title": "Maven Commands",
  "description": "Which Maven command compiles code, runs tests, and creates a JAR file?",
  "options": [
    "mvn compile",
    "mvn test",
    "mvn package",
    "mvn install"
  ],
  "correctAnswer": 2,
  "explanation": "mvn package runs the full lifecycle: compile -> test -> package (create JAR). mvn install goes further by copying to local repository.",
  "question": "Please select the correct option."
}