{
  "type": "MULTIPLE_CHOICE",
  "id": "lesson-11-5-config",
  "title": "External Configuration",
  "description": "Where does Spring Boot look for application.yml by default?",
  "options": [
    "src/main/java/",
    "src/main/resources/",
    "project root folder",
    "~/.spring/"
  ],
  "correctAnswer": 1,
  "explanation": "Spring Boot looks in src/main/resources/ for application.yml or application.properties.",
  "question": "Please select the correct option."
}