{
  "id": "challenge-7a-2-1",
  "type": "FREE_CODING",
  "title": "Test a Search Use Case",
  "description": "Write tests for a SearchNotesUseCase that filters notes by query string.",
  "difficulty": "intermediate",
  "hints": [
    {
      "level": 1,
      "text": "Use @BeforeTest to set up common test data"
    },
    {
      "level": 2,
      "text": "Test both title and content matching"
    },
    {
      "level": 3,
      "text": "Don't forget edge cases like blank queries"
    },
    {
      "level": 4,
      "text": "Use assertEquals for clear failure messages"
    }
  ],
  "testCases": [
    {
      "description": "All 6 test scenarios should pass",
      "expectedBehavior": "Tests verify all search functionality",
      "id": "test-1"
    }
  ],
  "instructions": "Write the code according to the description."
}