{
  "type": "FREE_CODING",
  "id": "21.6-challenge",
  "title": "Implement Token Refresh Hook",
  "description": "Create a useTokenRefresh hook that automatically refreshes JWT tokens before they expire.",
  "instructions": "Build a useTokenRefresh hook that:\n1. Decodes the JWT to get expiration time\n2. Checks if token expires within 5 minutes\n3. Automatically calls refresh endpoint before expiration\n4. Updates token in localStorage and auth context\n5. Handles refresh failures by logging out the user",
  "language": "typescript",
  "testCases": [
    {
      "id": "test-1",
      "description": "decodeToken correctly parses JWT payload",
      "expectedOutput": "Returns object with exp, iat, sub properties",
      "isVisible": true
    },
    {
      "id": "test-2",
      "description": "isTokenExpiringSoon returns true for tokens expiring within threshold",
      "expectedOutput": "Returns true when expiration < threshold",
      "isVisible": true
    },
    {
      "id": "test-3",
      "description": "Hook prevents multiple simultaneous refresh attempts",
      "expectedOutput": "isRefreshing ref prevents race conditions",
      "isVisible": true
    }
  ],
  "hints": [
    {
      "level": 1,
      "text": "JWT tokens are three base64-encoded parts separated by dots - use split('.') and atob() to decode"
    },
    {
      "level": 2,
      "text": "The exp claim is in seconds since epoch, multiply by 1000 for JavaScript milliseconds"
    },
    {
      "level": 3,
      "text": "Use useRef for isRefreshing to prevent re-renders and race conditions"
    }
  ],
  "commonMistakes": [
    {
      "mistake": "Not handling base64url encoding (replace - with + and _ with /)",
      "consequence": "The program will crash.",
      "correction": ""
    },
    {
      "mistake": "Forgetting to multiply exp by 1000 when comparing to Date.now()",
      "consequence": "The program will crash.",
      "correction": ""
    },
    {
      "mistake": "Not cleaning up the interval in useEffect return function",
      "consequence": "The program will crash.",
      "correction": ""
    }
  ],
  "difficulty": "intermediate"
}