{
  "id": "challenge-4a-4-1",
  "type": "FREE_CODING",
  "title": "Retry with Exponential Backoff",
  "description": "Implement a retry mechanism that attempts an operation multiple times with exponential backoff between attempts.",
  "difficulty": "intermediate",
  "hints": [
    {
      "level": 1,
      "text": "Use repeat() to try multiple times"
    },
    {
      "level": 2,
      "text": "Catch exceptions inside the loop, not outside"
    },
    {
      "level": 3,
      "text": "Remember to rethrow CancellationException"
    },
    {
      "level": 4,
      "text": "Double the delay after each failed attempt"
    }
  ],
  "testCases": [
    {
      "description": "Should succeed after retries",
      "expectedBehavior": "Returns 'Success on attempt 3'",
      "id": "test-1"
    },
    {
      "description": "Should use exponential backoff",
      "expectedBehavior": "Delays increase: 100ms, 200ms, 400ms...",
      "id": "test-2"
    }
  ],
  "instructions": "Write the code according to the description."
}