{
  "type": "FREE_CODING",
  "id": "14.8-challenge-0",
  "title": "Create Motion-Aware Animated Widget",
  "description": "Build a notification card that respects reduced motion preferences.",
  "instructions": "Create a NotificationCard widget that slides in from the right when shown. When the user has reduced motion enabled, it should fade in instantly instead of sliding. The card should include: (1) Check for reduced motion preference using MediaQuery, (2) Animate with slide + fade when motion is allowed, (3) Show instantly or with simple fade when reduced motion is preferred, (4) Include a dismiss button with proper semantics.",
  "language": "dart",
  "testCases": [
    {
      "id": "test-1",
      "description": "Contains the NotificationCard class",
      "expectedOutput": "NotificationCard",
      "isVisible": true
    },
    {
      "id": "test-2",
      "description": "Implements the build() method",
      "expectedOutput": "build",
      "isVisible": true
    },
    {
      "id": "test-3",
      "description": "Uses MediaQuery",
      "expectedOutput": "MediaQuery",
      "isVisible": false
    }
  ],
  "hints": [
    {
      "level": 1,
      "text": "Use MediaQuery.disableAnimationsOf(context) to check for reduced motion preference"
    },
    {
      "level": 2,
      "text": "Set _controller.value directly instead of animating when reduced motion is preferred"
    },
    {
      "level": 3,
      "text": "Use SlideTransition and FadeTransition for the full animation, but only FadeTransition for reduced motion"
    }
  ],
  "commonMistakes": [
    {
      "mistake": "Always animating regardless of motion preferences",
      "consequence": "Users with vestibular disorders may experience discomfort or nausea",
      "correction": "Check MediaQuery.disableAnimationsOf and provide instant or fade-only alternatives"
    },
    {
      "mistake": "Not announcing notifications to screen readers",
      "consequence": "Screen reader users miss important notifications",
      "correction": "Use SemanticsService.announce to alert screen reader users when notifications appear"
    }
  ],
  "difficulty": "intermediate"
}
