{
  "type": "MULTIPLE_CHOICE",
  "id": "lesson-15-5-deployment",
  "title": "Production Deployment",
  "description": "Why use environment variables for database credentials instead of hardcoding?",
  "options": [
    "Environment variables are faster",
    "Hardcoded values don't work in production",
    "Secrets shouldn't be in source code (security + flexibility)",
    "Environment variables use less memory"
  ],
  "correctAnswer": 2,
  "explanation": "Source code is often public (GitHub). Environment variables keep secrets separate and allow different values per environment.",
  "question": "Please select the correct option."
}