{
  "type": "MULTIPLE_CHOICE",
  "id": "lesson-10-1-http-methods",
  "title": "HTTP Request Methods",
  "description": "Which HTTP method should you use to UPDATE an existing resource?",
  "options": [
    "GET",
    "POST",
    "PUT",
    "DELETE"
  ],
  "correctAnswer": 2,
  "explanation": "PUT updates an existing resource. POST creates new resources. GET reads data. DELETE removes resources.",
  "question": "Please select the correct option."
}